スクショ,投稿文,リプ,いいね,インプ,日時,URL
,"ママ友には聞けないのでThreadsで…
専業主婦のみなさんに聞きたいです。

旦那さんの稼ぎでギリギリ生活してるって人どれくらいいる？貯金できてますか？節約はどこまでしてる？
旅行とかいけてますか？教えてください🥲

節約好きの主婦が少しでも余裕が欲しくて情報収集してます！少しずつシェアしていこうと思います🙌フォローして仲良くしてくれたら嬉しいです！ 
@neosyuhuchan











",11,267,"130,000",2025/6/17 13:24:30,https://www.threads.com/@neosyuhuchan/post/DK_QcigPW9w
,"専業主婦です！
Threadsの主婦さん見てると「うちも家計ギリギリです…」って人が多くて、勝手に仲間意識😌
節約ばっかりしてたけど、それだけじゃ無理だな〜と思って、ある日気づいた。500円節約するより、500円増やす方が良くない……！？って笑
気づいたこととか、やってよかったこと、ここにゆる〜くまとめてく予定です。

フォローして仲良くしてくれたらうれしいです☺︎







",0,35,"9,060",2025/6/17 16:52:48,https://www.threads.com/@neosyuhuchan/post/DK_oSNzu7Ex
,"専業主婦って、地味にずっと頭の中お金のことばっかり。
「今月ちょっとキツいな」「あと5日どう乗り切るか」とか。
節約してるつもりでも、結局カツカツから抜け出せない。

本気で暮らしを変えたかったら、
お金を減らさない工夫じゃなくて、増やす知恵が必要なんだろうな〜って最近感じます。
同じ人いますか？😌








",1,107,"13,000",2025/6/17 21:55:34,https://www.threads.com/@neosyuhuchan/post/DLAK7rxPZYj
,"みりん風調味料じゃなくて本みりんを選ぶ。安いウインナーじゃなくてシャウエッセンにする。低脂肪乳じゃなくて、ちゃんとした牛乳を買う。毎日食べるお肉は国産を選ぶ。

全部ほんの少しの違いだけど、とびきり贅沢したいわけじゃなくて、こういう生活を続けたいだけなんだよな。分かる人いる？

いいねすごい！ありがとうございますー！
たまにでもいいので贅沢したい人はおすすめの方法があるのでぜひフォローしておいてください✨全主婦の味方のネオ主婦ちゃん、覚えてってね🥹 
@neosyuhuchan












",384,"31,021","660,000",2025/6/18 15:09:32,https://www.threads.com/@neosyuhuchan/post/DLCBQxFPNhq
,"ちょっと待って、子ども産んだのに家計に余裕できたのバグすぎない？😂

妊娠して仕事辞めた時、お金の不安しかなかったのに
今は、子ども見ながらコツコツ稼げてて正直びっくりしてる

何やってるか気になる人いる？
いいね多かったら、ちゃんとThreadsで話すね🥹

LINEもDMも誘導しないから
気になる人はフォローだけしといてください🫶あんまり多くの人に見られたら消すかも。笑






",107,"1,585","210,000",2025/6/18 19:46:46,https://www.threads.com/@neosyuhuchan/post/DLCg_TLP_rs
,"え！？？15時間でフォロワー1200人まで増えててびっくり…🫨
物価上がりすぎてみんな困ってるよね、、、

私がやってる方法は一撃で10万！とかじゃないけど、
「頑張ったから今日は豪華なご飯にしちゃおうかな〜」とか
「コツコツ貯めて来月は旅行行くぞ〜！」が叶います🥰

ただ、知ってもやらない人が居たり、荒らす人が居たり、あまり広まりすぎると困るので、Threadsに投稿して数時間で消します🥲
本気の人にだけ教えたいのでフォローして通知つけて待ってて🙏







",0,250,"20,000",2025/6/19 11:01:03,https://www.threads.com/@neosyuhuchan/post/DLEJnq-PVzG
,"あの、ちょっと聞きたいんですけど…
Threadsで「主婦でもできる在宅ワークないですか？」に
集まってくる人たちって一体どんな仕事を紹介してくれるの？ほんとに稼げてる？？怪しくない？大丈夫？

話聞いた人がいたら
よかったらコメントで教えてください🥹







",9,44,"7,885",2025/6/20 21:42:31,https://www.threads.com/@neosyuhuchan/post/DLH30uTPNCT
,"え、やっぱりThreadsの在宅ワークって怪しいの多すぎん？🥲

私も最初めちゃ疑ってたけど、今やってる在宅ワークはちゃんと作業したぶんだけ報酬があるやつ。
単発でも継続でも仕事あるし、例えば30分zoomするだけで、家族3人でファミレス行けるくらいにはなる🍽️

家にいてもできる作業で、パート並かそれ以上、月5万〜10万くらいは余裕で受け取れてる🙏

「なにもしなくても稼げる」なんてのは嘘だけど、専業主婦しながらコツコツやれば全然現実的にお金になるよ。

詐欺に引っかかるくらいなら、最初から正しい手順でちゃんと仕事選んでほしい🥺
ほんとそれだけで全然違うから。






",19,94,"11,000",2025/6/21 20:14:29,https://www.threads.com/@neosyuhuchan/post/DLKSi1bvH5B
,"主婦やママさんで在宅ワークしたい人で、
ちゃんと家事育児もしながらコツコツ月5〜10万ほしいって人どれくらいいる？🙋‍♀️

私は勧誘とかはできないんだけど、仕事の取り方は教えられます🫶
自分で受注してるからこそ分かった「選ばれやすいコツ」とかある！

でも、最初は覚えること多いから、本気でやりたい人にだけ伝えたい😢
ラクして稼げる系じゃないけど、やる気あれば全然できるよ🙏






",5,74,"6,039",2025/6/21 20:53:51,https://www.threads.com/@neosyuhuchan/post/DLKXDMPPU0h
,"DMが止まらなくて…ほんとにありがたいけど対応しきれてなくてごめんなさい🙏

今、私がやってる在宅ワークについて急いでまとめてるので「ちゃんとした仕事で月5〜10万ほしい」って人は、もうちょっとだけ待っててください🥺

情報まとまったら投稿するので、気になる方はフォローしておいてね🫶✨






",1,120,"11,000",2025/6/22 11:25:00,https://www.threads.com/@neosyuhuchan/post/DLL6vvzPBKg
,"今まとめてる在宅ワークの方法、
なんとか急いで仕上げました…！！

今夜20時ごろに投稿出せそうです🫶
「ちゃんと家事育児しながら月5〜10万ほしい」って人は
ぜひ見にきてね✨

楽しみにしてくれてる人、ありがとう🥺






",0,183,"11,000",2025/6/22 16:42:45,https://www.threads.com/@neosyuhuchan/post/DLMfG-vOivv
,"今日出したnote、本気の人にだけ届いてる感じがしてめちゃくちゃ嬉しいです🥺🙏

言い忘れてたけど、
あまり広まりすぎると競争率も上がっちゃうので…
部数に応じてお値段は少しずつ調整してます！

本当に変わりたい人だけ見てくれたらそれでいい🫶✨
気になる人は固定ポストからどうぞ！






",0,11,"3,049",2025/6/22 21:37:12,https://www.threads.com/@neosyuhuchan/post/DLNAzpEPYIt
,"思ったより早く売り切れました…
Threadsって、本気の人こんな多いの？って正直びっくりしてます🫨

想定外だったので、このままの価格で再販します🙏

本気で在宅ワーク始めたい
生活にちょっとゆとりを持たせたい
そんな人に向けて、本気で書いたnoteです。

書いてある通りにやれば、絶対に元は取れます。
今の自分を変えたい人だけ、見てください。






",0,11,"3,474",2025/6/22 21:55:52,https://www.threads.com/@neosyuhuchan/post/DLNC8RWP2Qq
,"わぁ…そんなふうに言ってもらえて本当に嬉しいです🥹🙏
「怪しくない在宅ワーク」って、まだまだ探しにくい世界だから
少しでも安心できる道しるべになれたら…って思ってたので、届いてよかった🫶✨

これからも「ちゃんとやればちゃんと稼げる」って世界を広げていきたいです☺️
本当にありがとうございます🌸

















",0,1,"1,705",2025/6/22 21:56:56,https://www.threads.com/@neosyuhuchan/post/DLNDEF9PxoH
,"私も最初はLINE誘導ばっかりで怖くて、一歩踏み出すのにめちゃくちゃ時間かかって💦
だからこそ「ちゃんと自分で選べる情報」を出したくて、思い切ってまとめました🫶

安心してもらえたなら、それだけでもう書いてよかったって思えます✨
こちらこそ、丁寧に読んでくださってありがとうございます🌸
















",0,2,"1,917",2025/6/22 22:09:13,https://www.threads.com/@neosyuhuchan/post/DLNEeIkPT5I
,"なんて優しい言葉…心がぎゅってなりました🥹
「少しだけゆとりのある生活」って、ほんとにすてきな目標ですよね🌸
3児ママというだけでもすごいのに、その中で一歩踏み出そうとしてる姿に私も力をもらいました🫶

焦らず、できることからで大丈夫です☺️
一緒にゆるっと前に進んでいきましょ🌙✨



















",0,2,"4,723",2025/6/22 22:22:45,https://www.threads.com/@neosyuhuchan/post/DLNGBNjv5aC
,"うわぁぁ🥹そんなふうに言ってもらえてほんとにうれしい…！！
疑う気持ちもめっちゃわかるから、ちゃんと「安心して1歩踏み出せた」って聞けて本当に報われた気持ち🫶✨

ここから一緒にコツコツ頑張ってこうね！全力で応援してます🔥🔥🔥
困ったことあったらいつでも頼ってください☺️🌸


















",1,2,"2,154",2025/6/22 23:09:34,https://www.threads.com/@neosyuhuchan/post/DLNLYDwv2ME
,"在宅ワークのやり方、想像以上にたくさんの方に手に取ってもらえてほんとに嬉しいです🥹✨
そして…届いた感想、どれも優しくてあたたかくて泣きそうでした🙏

読んだ人全員が「ちゃんと仕事とれる」ように、手順もリアルも全部詰め込んで本気で書きました🫶
後悔はさせません！
これから在宅ワークに挑戦したい人の一歩を応援します！
















",0,8,"2,603",2025/6/23 11:39:29,https://www.threads.com/@neosyuhuchan/post/DLOhMmKP2rv
,"その一歩、めちゃくちゃ尊いです😭
怖い中で決断してくれたこと、本当にすごいと思います

「購入だけで終わらせない」って気持ち、ちゃんと伝わってきました！その覚悟があれば、きっと前に進めますよ！！応援してます！


















",0,1,"1,761",2025/6/23 11:40:46,https://www.threads.com/@neosyuhuchan/post/DLOhWBAPcyG
,"思い切って読んでくれてありがとうございます！
「子どものために頑張る」って言葉にすごく共感しました🥺

初心者でもちゃんと分かるようにって思って、手順や考え方を丁寧に詰め込んだので
こうして一歩踏み出してくれる方がいるのが本当に嬉しいです✨

まだ迷ってる方がいたら、まずは読んでみてほしい！
自分のペースで進めば大丈夫。ちゃんと未来に繋がるように書いたので！

















",0,2,"1,837",2025/6/23 11:42:02,https://www.threads.com/@neosyuhuchan/post/DLOhfRcvU8O
,"・子どもが昼寝中にスマホでちょっと作業
・30分で8,000円の案件もある
・電話なし、顔出しなし、家から一歩も出ない
・主婦でも活躍できる

在宅ワークって、こういうのが理想だったんだよね。

ガツガツ稼ぎたいわけじゃなくて、
「今日は頑張ったから外食しちゃおうかな〜」って
言えるくらいの余裕がほしかっただけなんだと思う✨







",2,23,"3,559",2025/6/24 10:25:59,https://www.threads.com/@neosyuhuchan/post/DLQ9lQav-Xg
,"妊娠して仕事を辞めて、
「このままずっと旦那の稼ぎだけでやってくのかな…」って不安だった。

でも今は、子どもが昼寝してる間に
在宅ワークで月5〜10万。
多いときは25万以上も受け取れた月がある。
まさか、自分がこんなふうに稼げる日が来るとは思ってなかった🫨

最初はアンケートで4円とかだったけど、
ちゃんとやり方を知って、仕組みを理解して、
主婦なりにコツコツやったらここまで来た。

「なにしてるの？」ってDMで聞かれるのでまとめました！在宅ワーク探してる人は固定から見てみてください✨







",0,17,"4,166",2025/6/24 17:00:49,https://www.threads.com/@neosyuhuchan/post/DLRqxFEtT0d
,"専業主婦って、節約が正義みたいな空気あるけど、
電気消して、水出しっぱなし怒って、買い物はいつもチラシとにらめっこ。

それ、家族のためって言いながら、
自分だけ我慢する生活じゃない？

わたしはもうやめた。
節約やめたら、少しだけ心に余裕ができた。

500円削るより、500円増やす方が現実的だったって話。

同じように「これ以上はもうしんどい」って思ってる主婦さんに届いてほしい。





",0,17,"2,312",2025/6/25 9:45:02,https://www.threads.com/@neosyuhuchan/post/DLTdsI9zB_u
,"引用ありがとうございます🥲

一度失敗されたのに、また一歩踏み出そうとしてくれたその勇気、本当に尊敬します…！

私自身も「ちゃんと届けたい人にだけ伝わればいい」って思って発信してるので、そう言っていただけるのが一番うれしいです。

これからも一緒に、無理なく一歩ずついきましょう🫶


















",0,1,918,2025/6/25 9:47:49,https://www.threads.com/@neosyuhuchan/post/DLTeAiaTizd
,"そうそう、それなんですよ…！
一攫千金とか贅沢じゃなくて、
悩まず買い物できる毎日がほしいだけなんですよねー！

読んでくれて、行動してくれて、本当にありがとうございます🫶
一緒に在宅ワークがんばりましょう☺️










",0,0,"1,342",2025/6/25 9:50:01,https://www.threads.com/@neosyuhuchan/post/DLTeQoFTnIg
,"あの…正直泣きそうです🥲

「noteって怖かったけど初めて買ってみました」
そんな声がたくさん届いてて…もう本当にありがとう。

顔も知らない相手の言葉に、お金を出すってすごく勇気のいること。それでも「このままじゃダメだ」って気持ちが背中を押してくれたんだよね。

私自身、パートにも出られず、家計の不安が頭から離れなかった日々があった。だからこそ、本気で書いたし、本気の人に届いてほしかった。

このnoteは、キラキラでも一発逆転でもない。
でも「主婦が暮らしを立て直す方法」としては、ちゃんと現実的です。

ありがたいことに感想が増えてきてるので、まだ見てない人は少し覗いてみてください🫶
勇気を出してくれた仲間がたくさんいます！！







",0,6,"1,671",2025/6/25 9:52:26,https://www.threads.com/@neosyuhuchan/post/DLTeiT9zWnZ
,"厳しいこと言うのかもだけど、人って無料の情報だとやる気になれないんだよね。実は私もそうだったんだよ。
だからあえて有料にしてるんだけど、それでも手の届きそうな額に設定してます。

無料の情報だとただ見て終わりになる人が多いけど、お金を出したら「元を取ろう」って本気で行動するよね？

そして、noteに書いていることを本気で・真面目に取り組んでもらったらちゃんと成果出る。
で、note代を取り戻す頃には月5マン〜10マンなんか余裕で手にはいる土台が整ってる。

買ってくれた人にはちゃんと成果出してほしい。私はそこまで考えて書いてます！







",0,8,"2,058",2025/6/25 9:59:31,https://www.threads.com/@neosyuhuchan/post/DLTfWNmTRII
,"「お金を増やしたいけど、スキルもないし時間もない」
在宅ワークを調べる前から諦めてる主婦、多くない？😢
実は私もそうだったんだけど…
それって副業＝スキルがある人だけがやるもの！っていう勘違いが原因かもしれない🥹

実際は、「稼げるかどうか」より
「どう稼げる仕組みに乗るか？」の方がずっと大事だった。

私はずっと「パートか節約しか道がない」と思ってたけど、家にいながら、作業した分だけ報酬が出る仕事って意外とある。

顔出しも電話もなしで月5〜10万。しかも安定してる。やり方次第でちゃんと暮らしに余裕が出るって証明してます！

ぶっちゃけ、最初はアンケートで1回4円とかだったし、Zoomで受けた仕事も最初は緊張して震えてた（笑）

でも「どうやって受注するか」「選ばれるプロフィールは？」っていう仕組みを知ったら、一気に変わったんだよね。

悩んでる人が多いって感じたので、その仕組みをまとめたnoteをつくりました。
決してラクして稼ぐ内容じゃないけど、
「主婦のままで暮らしに余裕をつくる方法」としては
いちばん現実的だと思う。

気になる方は固定ポストからどうぞ！🫶






",0,4,"1,377",2025/6/25 18:00:36,https://www.threads.com/@neosyuhuchan/post/DLUWZvqKWYb
,"はっきり言います。

私が紹介してる在宅ワークのやり方は
Threadsを経由してお仕事をもらう、とか
インスタのインフルエンサーになる！とかではないです。

ちゃんと
・仕事をお願いしたい人
・仕事を受けたい人

↑このマッチングを成立させる為の
信頼できるサイトでのやり方なので安心してください！🙂‍↕️
だから怪しいかな？とか詐欺かな？とか心配する必要は一切ナシ。







",0,20,"3,173",2025/6/25 21:28:06,https://www.threads.com/@neosyuhuchan/post/DLUuJlHvmkW
,"「怪しい在宅ワークじゃない？」ってよく聞かれます。

大丈夫、私がやってるのは
・仕事をお願いしたい人
・受けたい主婦さん
この【需要と供給】がちゃんとある、マッチングサイトを使った方法です！

SNSで発信したり、フォロワー増やす必要もありません😌







",0,6,"1,808",2025/6/26 8:00:39,https://www.threads.com/@neosyuhuchan/post/DLV2igktuL6
,"「在宅ワークって何するの？」ってよく聞かれるけど、
案件は自分で選べます！

私が今までやったのは、
・Zoom30分で8,000円
・エステやサロン体験で数万円
・SNSの運用代行で数十万円

こんな感じなので、最低限のコミュニケーションと
スマホの操作ができれば問題なし！

むしろ大事なのは、、、、↓

・言われたことをそのままやる素直さ
・わからないことをそのままにしない誠実さ
画面越しのやり取りだからこそ、
まじめな人が選ばれます🤫
ただ初心者が案件を獲得するためには
なんとなくやるだけじゃなかなか難しい💦
お仕事をもらいやすくなるコツはここに全部書いてます！
→ note.com/neo_s…



















",1,7,"2,442",2025/6/26 10:05:01,https://www.threads.com/@neosyuhuchan/post/DLWExcSTk7F
,"在宅ワークっていうと、
「Threadsで探してDMからzoomの日程決めて……」みたいなイメージあるかもだけど、

私がやってるのはもっと地味で、ちゃんと依頼主がいる仕事です。

1件ずつ丁寧に受注して、作業したぶんだけ報酬が出る。
だから再現性があるし、主婦にも続けやすい。






",0,14,"2,434",2025/6/26 12:00:06,https://www.threads.com/@neosyuhuchan/post/DLWR8RvBcqf
,"フォロワーさんに聞きたいんですが、
在宅ワークをするにあたって不安なことってなんですか？🥹
良かったら教えてください🙌






",2,3,"2,241",2025/6/26 21:22:08,https://www.threads.com/@neosyuhuchan/post/DLXSQwavs_y
,"DMくださってた方ありがとうございます！
昨日全て返し終わりました🙏
（たくさんきてたので遅くなってすみません…！）

また何かあればお気軽にDMください！✨






",0,3,"1,845",2025/6/26 21:22:53,https://www.threads.com/@neosyuhuchan/post/DLXSWN3vReb
,"ほんと共感しかないです🥲
私も最初、スレッズの在宅ワーク系ってどこまで信じていいか分からなかったし、LINE誘導とか見るたび疑ってました…（笑）

だからこそ、少しでも「怪しくないって伝えたい！」って気持ちでnoteを書いたので、こうして届いたことが本当に嬉しいです。

子どものしたいを我慢させたくない…まさに私もそこが原動力だったから泣けます😭

買ってよかったと思ってもらえるように、私も引き続きちゃんと発信続けていきます！ありがとうございます！


















",0,0,597,2025/6/27 8:00:36,https://www.threads.com/@neosyuhuchan/post/DLYbVCkzSr4
,"出産や育児って、それだけで人生の大転換なのに「働けないかも」って不安はほんとうによく分かります。
私も同じように調べるたびに怪しい副業にぶつかって疲れてたから、「ちゃんと段階をふんで、必要なことだけ書こう」って決めてnoteを作りました。

小さな一歩から始めたい人に、こうして届いて嬉しいです🫶安心できる情報を、これからもちゃんと発信していきますね！ありがとうございます！










",0,1,791,2025/6/27 8:02:05,https://www.threads.com/@neosyuhuchan/post/DLYbf3dzZpj
,"在宅ワークを探しすぎて、「これもどうせまた詐欺じゃないの？」って不安になりますよね。私も最初、在宅ワーク調べるたびに思ってました…。

でもね実は本当の詐欺ほど特徴がハッキリしてる。

「無料でできますよ」
「誰でも絶対に稼げます」
「〇〇するだけで月収100万」

こんな“ホイホイついて行きたくなる言葉”には要注意。
不安につけ込むのが常套手段なんですよね🥲

だから私は、ちゃんとした仕組みがあるものを選んで固定ポストにまとめてます。
ぶっちゃけ、最初は全然楽じゃないし行動必須です。でも、頑張れば頑張った分だけ楽になっていきます！
「正しい方法で、自分の力で稼ぎたい」人だけ見てください







",0,3,"1,334",2025/6/27 8:09:44,https://www.threads.com/@neosyuhuchan/post/DLYcX4WzSLx
,"「なんで在宅ワークのやり方を無料で教えてくれないの？」って聞かれたけど…

逆に、見ず知らずの人に無料で全部教える理由、ある？🥲

私もここまで来るのに、何度も失敗して、時間もお金も使ってきた。noteには、その遠回りをしない最短ルートを全部まとめてます。

正直、やるかどうかも分からない人にただで教えたいとは思わない。でも、少しでもお金を出した人って「元を取りたい！」って行動するんだよね。

自己流で1年かかるところを、たった1ヶ月で進める可能性もあるし、30分で8,000円になる案件の実例や、コピペOKのテンプレートまでつけてる。
しかも、ちゃんと成果が出るように導線も組んでます。

ここだけの話、最初は4,000円台だったんです。
早く行動した人ほどお得になってます🫶






",0,12,"1,720",2025/6/27 8:20:21,https://www.threads.com/@neosyuhuchan/post/DLYdltNTOEn
,"正直、Threadsでよく見る「副業」はほぼ全部スルーしてる。だって怪しいのばっかだし、詐欺も多いよね。

私がやってるのは、
・顔出しなし
・家族に自信持って言える
・インフルエンサーになる必要もなし

そして月5〜10万円ならちゃんと成果出る！
普通の主婦が暮らしを変えるには、ちょうどいい方法だったから続けられてる😌







",0,15,"2,323",2025/6/27 12:00:38,https://www.threads.com/@neosyuhuchan/post/DLY2zCmpM3W
,"もうThreadsで「いい在宅ワークないですか？」って聞くの、やめよ？
正直、それに反応してる人って…全員あやしくない？🥲
中にはサクラもいると思う。

私がやってるのは、
人に頼らず自分の力で仕事を見つけて収入を得る方法。
だから詐欺にも巻き込まれないし、ちゃんと安定してる。

・仕事の探し方
・受注するコツ
・選ばれるプロフィールの作り方

全部まとめてるのが、固定ポストのnoteです☺️
「まじめにやって暮らしを変えたい」って人は見てみてね。







",0,7,"1,542",2025/6/27 19:01:54,https://www.threads.com/@neosyuhuchan/post/DLZnAg7Pk5Q
