予約投稿日時,予約投稿時間_時,予約投稿時間_分,ポスト文
2026/02/05,9,0,あの、私ドがつくほどの機械音痴なんですが、最近めちゃくちゃやらかして凹んでるので、よかったらみなさんの機械音痴エピソードを教えてください😂
2026/02/05,14,0,ドラッグストアで日用品買って「ポイントで払います」って言う瞬間のドヤ顔誰かに見せたい😎現金が減らないって主婦にとって最高の精神安定剤だよね💊
2026/02/05,21,0,スマホの画面に「アップデートしてください」って出ると壊れるんじゃないかってドキドキして「後で」を押し続けてる人いない？📱
2026/02/06,9,0,育児の合間の15分、みんな何してる？私はこの時間だけは家事放置して、こっそりスマホでお小遣い作りしてるよ🍵
2026/02/06,14,0,主婦にとっての1000円ってめちゃくちゃ大金だよね？スーパーで特売の卵のために自転車走らせる労力考えたら、ポイント貯めるのって本当にすごいこと✨
2026/02/06,21,0,旦那が隣でテレビ見てる横でポチポチ作業中...まさか私がスマホでお小遣い稼ぎしてるとは夢にも思ってないはず🤫
2026/02/07,9,0,昔は徹夜も平気だったのに最近は夕飯食べたらもう眠くて...隙間時間のポイ活も寝落ちとの戦い😪1日5分だけって決めてなんとか続いてる✨
2026/02/07,14,0,「1日3分で月収100万」みたいな広告、怖くてすぐ閉じちゃう💦地味にコツコツ月5万貯めるのが私には合ってる気がする🌸
2026/02/07,21,0,家族のためももちろんあるけど、やっぱり自分のために使えるお金があるって心の余裕が全然違う💓
2026/02/08,9,0,トイレに入って「やっと一人の時間💦」って思ったら、すぐに「ママー」って呼ばれた😂アラフォー母ちゃん、自分の時間って本当にないよね・・・
2026/02/08,14,0,スマホがある時代に生まれて良かった。機械音痴の私でも、ポチポチするだけでお小遣いが貯まるの奇跡に近い😂
2026/02/08,21,0,朝から子供の水筒忘れた！ってダッシュで学校届けてすでにHPゼロ...でもポイ活で10円ゲットした自分を褒めてあげたい☕️
2026/02/09,9,0,洗濯物、畳まずに「山」の中から発掘して着るスタイルだけど何か問題でも？🙄完璧なママなんて目指してたら身が持たない🍵
2026/02/09,14,0,100均に行くとついつい買いすぎちゃうから、節約のために行ってるって自信もって言えなくなってきた…笑　私だけ？
2026/02/09,21,0,パスワード忘れてメモした紙をどこにやったか忘れる...機械音痴には「顔認証」だけが唯一の救い✨
2026/02/10,9,0,Noteで月いくら！って投稿がすごい流れてくるけど、普通にすごいなぁと思う反面、信じられない笑 人にお金貰えるような体験談なんて何もないよ🥺
2026/02/10,14,0,前まで毎日お金のことばかり考えてたけど…最近はそれがなくなってきた。嬉しい。
2026/02/10,21,0,雨の日は家でゴロゴロしながらポイ活するのが最高☔️外に出なくていい正当な理由ができた気がする✨
2026/02/11,9,0,機械苦手な仲間はフォローしてね！一緒におやつ代ゲットしよ🍩
2026/02/11,14,0,子供が寝た瞬間、安堵と一緒にドッと疲れが押し寄せてくる...今日もお疲れ私、お疲れみんな🍵
2026/02/11,21,0,毎日15分の作業なんて意味ある？って思ってたけど、1ヶ月続けたらランチ1回分くらいにはなったよ😭✨
